نص السؤال 	رقم السورة 	رقم الآية 	رقم آية1	رقم آية2
لما كان تضييع نصوص الوحي القرآني أمراً مستحيلاً على الشيطان لأن الله قدر حفظه فإن محاولة الشيطان تكون بتضييع معنى النص بالخطأ في الفهم. اذكر آيةً تحمل هذا المعنى.	22	﴿وَما أَرسَلنا مِن قَبلِكَ مِن رَسولٍ وَلا نَبِيٍّ إِلّا إِذا تَمَنّى أَلقَى الشَّيطانُ في أُمنِيَّتِهِ فَيَنسَخُ اللَّهُ ما يُلقِي الشَّيطانُ ثُمَّ يُحكِمُ اللَّهُ آياتِهِ وَاللَّهُ عَليمٌ حَكيمٌ﴾ [الحج:52] حيث جاء فى تفسير هذه الآية أن الشيطان يحدث الخطأ إما على لسان المُبَلِّغ أو فى عقل من تبلغه الدعوة أو بتضييع آثار الفهم الصواب للنص وفى ذلك كان أمر الله سبحانه وتعالى ﴿فَإِذَا قَرَأْتَ الْقُـرْآنَ فَاسْـتَعِذْ بِاللّهِ مِنَ الشَّـيْطَانِ الرَّجِيمِ﴾.	52	
الحق واحد والباطل يتعدد. اذكر آية تبين تخبط الكفار بين أقوال عديدة كلها باطلة.	21	{ بَلْ قَالُوا أَضْغَاثُ أَحْلَامٍ بَلِ افْتَرَاهُ بَلْ هُوَ شَاعِرٌ فَلْيَأْتِنَا بِآيَةٍ كَمَا أُرْسِلَ الْأَوَّلُونَ}[الأنبياء :5 ]	5	
من منهج أهل الباطل أنهم يتهربون من مناقشة الحق إلى الانتقاص من قائله. اذكر آية تحمل هذا المعنى.	21	{وَإِذَا رَآكَ الَّذِينَ كَفَرُوا إِن يَتَّخِذُونَكَ إِلَّا هُزُوًا أَهَٰذَا الَّذِي يَذْكُرُ آلِهَتَكُمْ وَهُم بِذِكْرِ الرَّحْمَٰنِ هُمْ كَافِرُونَ} [ الأنبياء : 36 ]	36	
أورد بعض المفسرين ما يُعرف بقصة الغرانيق، وذلك عند تفسيرهم لقوله تعالى: ﴿وَمَا أَرْسَلْنَا مِن قَبْلِكَ مِن رَّسُولٍ وَلَا نَبِيٍّ إِلَّا إِذَا تَمَنَّىٰ أَلْقَى الشَّيْطَانُ فِي أُمْنِيَّتِهِ فَيَنسَخُ اللَّهُ مَا يُلْقِي الشَّيْطَانُ ثُمَّ يُحْـكِمُ اللَّهُ آيَاتِهِ ۗ وَاللَّهُ عَلِيمٌ حَكِيمٌ﴾ [الحج:58]، والقصة تزعم أن رسول الله قرأ يوما بمكة سورة النجم، حتى إذا ما وصل موضع ﴿أَفَرَأَيْتُمُ اللَّاتَ وَالْعُزَّىٰ۝ وَمَنَاةَ الثَّالِثَةَ الْأُخْرَىٰ﴾ ألقى الشيطان على لسانه أو في سكتته: (تلك الغرانيق العلى وإن شفاعتهن لترتجى). وقد بين علماء الحديث بطلان هذه القصة سندا ومتنا. ومن وجوه بطلانها أن الله عز وجل شاء بحكمته ورحمته أن يبقى وحيه نقيا صافيا ﴿لِّيَهْلِكَ مَـنْ هَلَكَ عَن بَيِّنَةٍ وَيَحْيَىٰ مَنْ حَيَّ عَن بَيِّنَةٍ﴾ [الأنفال:42]. بينما لو وقعت القصة للزم منها التباس الحق بالباطل في الوحي. اذكر آية من غير هذا الجزء تبين أن القرآن -عدا عن حفظه في ذاته- فإنه لا يمكن أن يختلط بزور أو أي شيء غير الحق.	41	﴿لا يَأتيـهِ البـاطِلُ مِن بَيـنِ يَدَيـهِ وَلا مِن خَـلفِهِ تَنزيـلٌ مِن حَكيـمٍ حَميـدٍ﴾ [فصلت:42].	42	
نهى الله نبيه، ومن بعده أمته، أن نمد أعيننا إلى ما متع به الكافرين في الدنيا. ورسول الله يصبرنا بحقيقة أن ما حرمنا منه في الدنيا وتمتعوا هم به سيكون لنا في الآخرة ويُحرمون هم منه. كما قال في الحديث الذي رواه البخاري: (لا تلْبَسُوا الحرير ولا الديباج، ولا تشربوا في آنية الذهب والفضة ولا تأكلوا في صِحَافِهِا؛ فإنَّهَا لهم في الدنيا ولنا في الآخرة). اذكر موضعا في القرآن فيه أن حقيقة حصر الجنة على المؤمنين ينبغي أن تعينهم وتكفيهم كزاد يتزودون به في طريقهم إلى الله. خاصة لمن تعلق قلبه بالآخرة عم طريق العبادة.	21	﴿وَلَقَد كَتَبنا فِي الزَّبورِ مِن بَعدِ الذِّكرِ أَنَّ الأَرضَ يَرِثُهـا عِبادِيَ الصّالِحونَ ۝ إِنَّ فِي هَٰذَا لَبَلَاغًا لِّقَوْمٍ عَابِدِينَ﴾ [الأنبياء:105-106]. والأرض عند كثير من المفسرين في قوله تعالى ﴿أَنَّ الأَرضَ يَرِثُهـا عِبادِيَ الصّالِحونَ﴾ هي أرض الجنة، بدليل قوله تعالى: ﴿وَقَالُوا الْحَمْـدُ لِلَّهِ الَّذِي صَدَقَنَا وَعْدَهُ وَأَوْرَثَنَـا الْأَرْضَ نَتَبَوَّأُ مِنَ الْجَنَّةِ حَيْـثُ نَشـَاءُ ۖ فَنِعْمَ أَجْرُ الْعَامِلِينَ﴾ [الزمر:74]. و﴿بَلَاغًا﴾ عند بعض المفسرين هي بمعنى البلغة التي يَبلغ به المسافر قصده من زادٍ، أي ما يكفيه من طعام وشراب.  فإن حقيقة أن الجنة هي للصالحين فقط هي حقيقة يستصحبها العابدون في مشوارهم في الدنيا، فتصبرهم على أذاها وتكاليفها، كما يتبلغ المسافر إلى قصده ببلغة من طعام وشراب. وهذا المعنى أشد حضوراً كلما كان العبد أصح عبادة ﴿ إِنَّ فِي هَٰذَا لَبَلَاغًا لِّقَوْمٍ عَابِدِينَ﴾.	105	106
تجد من يمضي -عمره في الظلم والإفساد وترويج الباطل ومحاربة الحق. اذكر آية تصور لحظة تمثل ذروة ندمهم على هذا كله ويقينهم بما أنكروا من قبل.	21	{وَلَئِن مَّسَّتْهُمْ نَفْحَةٌ مِّنْ عَذَابِ رَبِّكَ لَيَقُولُنَّ يَا وَيْلَنَا إِنَّا كُنَّا ظَالِمِينَ}[الأنبياء : 46]	46	
تلمَعُ لُمَعُ الحق للعبد، وحتى أعتى الكفرة يكون الحق قد ظهر لهم في محطات. فمن استغل هذه اللُّمع نجا وسعد، ومن تكبر وأعرض وجحد شقى. اذكر آيتين متتاليتين تصف موقفا لمع فيه الحق لقوم فجحدوه.	21	{فَرَجَعُوا إِلَىٰ أَنفُسِهِمْ فَقَالُوا إِنَّكُمْ أَنتُمُ الظَّالِمُونَ(٦٤) ثُمَّ نُكِسُوا عَلَىٰ رُءُوسِهِمْ لَقَدْ عَلِمْتَ مَا هَٰؤُلَاءِ يَنطِقُونَ(٦٥) }[الأنبياء: 64-65]	64	65
كلمة بمعنى "نُضَيِّق" وردت في أية في هذا الجزء، يؤدي عدم فهمها لسوء فهم كبير. اذكر هذه الكلمة.	21	﴿وَذَا النّونِ إِذ ذَهَبَ مُغاضـِبًا فَظَنَّ أَن لَن #نَقدِرَ# عَلَيهِ فَنادى فِي الظُّلُمـاتِ أَن لا إِلهَ إِلّا أَنتَ سُبحانَكَ إِنّي كُنـتُ مِنَ الظّالِمينَ﴾ [الأنبياء:87] جاء في تفسير ابن كثير: (﴿فَظَنَّ أَن لَن نَقدِرَ عَلَيهِ﴾ أي: نضيق عليه في بطن الحوت. يروى نحو هذا عن ابن عباس، ومجاهد، والضحاك، وغيرهم، واختاره ابن جرير، واستشهد عليه بقوله تعالى: ﴿وَمَن قُدِرَ عَلَيْـهِ رِزْقُهُ فَلْيُنفِقْ مِمَّا آتَاهُ اللَّهُ ۚ لَا يُكَلِّفُ  اللَّهُ  نَفْسـًا  إِلَّا  مَا  آتَاهَــا ۚ  سَيَـجْعَلُ  اللَّهُ  بَعْدَ   عُسْـرٍ   يُسْرًا﴾ [الطلاق:7]).	87	
قال لك صديقك: لماذا نخوف الناس من الله ولا نكتفي بالحديث عن رحمة الله والرجاء فيها؟ لماذا نرهبهم من الله بدل أن نحببهم فيه؟ استوقفتك آية ولفت نظرك فيها أن من لم يقوموا بمعصية أبداً بالإجماع، بل هم مجتهدون في الطاعة يخافون الله، فكيف بنا نحن؟! اذكر أربع كلمات تدل هذا المعنى.	21	﴿يَعلَمُ ما بَينَ أَيديـهِم وَما خَلفَهُم وَلا يَشـفَعونَ إِلّا لِمَـنِ ارتَـضى #وَهُم مِن خَشيَـتِهِ مُشفِقونَ#﴾ [الأنبياء:28]  فأخبر سبحانه هنا عن خشية الملائكة ربهم سبحانه.	28	
اذكر كلمتين تدلان على أن هذا القرآن شرف لمن عمل بما فيه.	21	﴿لَقَد أَنزَلنا إِلَيكُم كِتابًا #فيهِ ذِكرُكُم# أَفَلا تَعقِلونَ﴾    [الأنبياء:10]  فيه ذكركم: يعني فيه شرفكم، كما قال تعالى في آية آخرى ﴿وَإِنّـَهُ لَـذِكْـرٌ لَّـكَ وَلِقَوْمِكَ﴾ [الزخرف:44].	10	
لك صديق بدأ يهتم بدراسة الفلسفة وأصبح يغلب عليه استخدامها في دعوته الناس إلى الاستقامة. اذكر أربع كلمات من آية تُبين بِها له أنه حاد عن الطريق الذي أُمر به النبي صلى الله عليه وسلم.	21	﴿قُل إِنَّما أُنذِرُكُم بِالوَحيِ وَلا يَسمَعُ الصُّمُّ الدُّعاءَ إِذا ما يُنذَرونَ﴾   [الأنبياء:45] ﴿إِنَّما﴾ أداة حصر، فــ﴿إِنَّما أُنذِرُكُم بِالوَحيِ﴾ تعني إنما نذارتي لكم هي بالوحي، بما يوحيه إلي ربي. (مستفاد من أضواء البيان/الشنقيطي) والذي يجعل الفلسفة مُرتكَزَهُ في الدعوة قد حاد عن هذا المنهج الذي وجه الله تعالى إليه نبيه صلى الله عليه وسلم، وجعل الفلسفة عوضاً عن الوحي.	45	
ترك العبادة مذلة لتاركها. اذكر سبع كلمات من آية تذكرك بهذا المعنى.	22	﴿أَلَم تَرَ أَنَّ اللَّهَ يَسجُدُ لَهُ مَن فِي السَّـماواتِ وَمَن فِي الأَرضِ وَالشَّـمسُ وَالقَمَرُ وَالنُّجومُ وَالجِبالُ وَالشَّجَرُ وَالدَّوابُّ وَكَثيرٌ مِنَ النّـاسِ وَكَثيرٌ حَقَّ عَلَيهِ العَذابُ #وَمَن يُهِنِ اللَّهُ فَما لَهُ مِن مُكرِمٍ# إِنَّ اللَّهَ يَفعَلُ ما يَشاءُ﴾ [الحج:18]	18	
آية فيها تهكم بمن يظن أن الغلبة لن تكون لهذا الدين.	22	﴿مَن كَـانَ يَظُنُّ أَن لَّن يَنصُرَهُ اللَّهُ فِي الدُّنْيَا وَالْآخِرَةِ فَلْيَمْدُدْ بِسَـبَبٍ إِلَى السَّمَاءِ ثُمَّ لْيَقْطَعْ فَلْيَنظُرْ هَلْ يُذْهِبَنَّ كَيْدُهُ مَا يَغِيظُ﴾ [الحج:15] قَالَ ابْنُ عَبَّاسٍ: مَنْ كَانَ يَظُنُّ أَنْ لَنْ يَنْصُرَ اللَّهُ مُحَمَّداً ﷺ فِي الدُّنْيَا وَالْآخِرَةِ، ﴿فَلْيَمْدُدْ بِسَبَبٍ﴾ أَيْ: بِحَبْلٍ ﴿إِلَى السَّمَاءِ﴾ أَيْ: سَمَـاءِ بَيْتِـهِ، ﴿ثُمَّ ليَقْطَعْ﴾ يَقُولُ: ثُمَّ لِيَخْتَنِقْ بِهِ... والمعنى: مَنْ ظَنَّ أَنَّ اللَّهَ لَيْسَ بِنَاصِرٍ مُحَمَّداً ﷺ وَكِتَابَهُ وَدِينَهُ، فَلْيَذْهَبْ فَلْيَقْتُلْ نَفْسَهُ، فَإِنَّ اللَّهَ نَاصِرُهُ لَا مَحَالَةَ.	15	
ما في قلوب أهل الكفر من حنق وغيظٍ على الدين يظهر في ملامحهم. اذكر آية فيها هذا المعنى.	22	﴿وَإِذَا تُتْلَىٰ عَلَيْهِمْ آيَاتُنَا بَيِّنَاتٍ #تَعْرِفُ فِي وُجُوهِ الَّذِينَ كَفَرُوا الْمُنكَرَ# ۖ يَكَادُونَ يَسْـطُونَ بِالَّذِينَ يَتْلُونَ عَلَيْهِمْ آيَاتِنَا ۗ قُلْ أَفَأُنَبِّئُكُم بِشَرٍّ مِّن ذَٰلِكُمُ ۗ النَّـارُ وَعَدَهَا اللَّهُ الَّذِينَ كَفَرُوا ۖ وَبِئْسَ الْمَصِيرُ﴾ [الحج:72] قال السعدي: (من بغضها وكراهتها، ترى وجوههم معبسة، وأبشارهم مكفهرة).	72	
ذكر الله تعالى قصة تنجية نبي من الأنبياء عليهم السلام ممن قصده بسوء في أكثر من موضع، أحدهما في هذا الجزء. وذكر في وَصْفِ ما جازاهم به كلمتين مختلفتين، من يقرأهما قد لا يفهم سبب تنويعهما. لكن إذا رجعت إلى سياق الآيات عرفتَ أن كل كلمة في وصف جزائهم كانت أنسب لسياقتها. اذكر الكلمتين (إحداهما من هذا الجزء).	21/37	{وَأَرَادُوا بِهِ كَيْدًا فَجَعَلْنَاهُمُ #الْأَخْسَرِينَ# [الأنبياء:70] .. {فَأَرَادُوا۟ بِهِۦ كَیۡدࣰا فَجَعَلۡنَـٰهُمُ #ٱلۡأَسۡفَلِینَ#}[الصَّافَّاتِ:98] الكـلمتان هـما ﴿الْأَخْسَـرِينَ﴾ [الأنبياء:70] و﴿الْأَسْفَلِينَ﴾ [الصافات:98] في قصة نبي الله إبراهيم عليه السلام. قال الإسكافي في درة التنزيل: (في قصة إبراهيم عليه السلام في سورة الأنبياء قال[تعالى]: ﴿وَأَرَادُوا بِهِ كَيْدًا فَجَعَلْنَـاهُمُ الْأَخْسَرِينَ﴾، وفي الصـافات ﴿فَأَرَادُوا بِهِ كَيْدًا فَجَعَلْنَاهُمُ الْأَسْفَلِينَ﴾، وهي قصة واحدة، فما الحكمة فيه؟ وفي سورة الأنبياء أخبر الله تعالى عن إبراهيم عليه السلام أنه كاد أصنامهم ﴿وَتَاللَّهِ لَأَكِيدَنَّ أَصْنَامَكُم﴾ [الأنبياء:57]، وأخبر أنهم أرادوا أن يكيدوه كذلك ﴿وَأَرَادُوا بِهِ كَيْدًا﴾، فتقابل الكيدان، فلما عاد عليهم كيدهم عبّر بالخسارة، فقال تعالى: ﴿وَأَرَادُوا بِهِ كَيْدًا فَجَعَلْنَاهُمُ الْأَخْسَرِينَ﴾. وفي الصافات قال قبلها ﴿قَالُوا ابْنُوا لَهُ بُنْيَانًا فَأَلْقُوهُ فِي الْجَحِيمِ﴾ فلما رموا نبي الله من فوق البناء إلى أسفل، عاقبهم الله من جنس عملهم فجعلهم هم الأسفلين، وأصبح أمر نبي الله عاليًا)	70	98
من خرج من التوحيد الصافي إلى الشرك بالله فإنه لا يجد شيئاً إلا التردي والتشتت بين معتقدات لا قرار لها. اذكر آية تدل على هذا المعنى.	22	﴿حُنَفَـاءَ لِلَّهِ غَيْرَ مُشْرِكِينَ بِهِ ۚ #وَمَن يُشْرِكْ بِاللَّهِ فَكَأَنَّمَـا خَرَّ مِنَ السَّمَاءِ فَتَخْطَفُهُ الطَّيْرُ أَوْ تَهْوِي بِهِ الرِّيحُ فِي مَكَانٍ سَحِيقٍ#﴾ [الحج:31] قال السعدي: ﴿فَكَأَنَّمَا خَرَّ مِنَ السَّمَاءِ﴾ أي: سقط منها، ﴿فَتَخْطَفُهُ الطَّيْرُ﴾ بسرعة ﴿أَوْ تَهْوِي بِهِ الرِّيحُ فِي مَكَانٍ سَحِيقٍ﴾ أي: بعيد. كذلك المشرك، فالإيمان بمنزلة السماء، محفوظة مرفوعة. ومن ترك الإيمان بمنزلة الساقط من السماء، عرضة للآفات والبليات، فإما أن تخطفه الطير فتقطعه أعضاء، كذلك المشرك إذا ترك الاعتصام بالإيمان تخطفته الشياطين من كل جانب، ومزقوه، وأذهبوا عليه دينه ودنياه.	31	