نص السؤال	رقم السورة	رقم الآية	رقم آية1
اذكر آية ترد بها على من يبرر وضع تشريعات مخالفة لأحكام الله تعالى من باب مراعاة الحاجات الإنسانية والتخفيف عن الناس.	67	{ أَلَا یَعۡلَمُ مَنۡ خَلَقَ وَهُوَ ٱللَّطِیفُ ٱلۡخَبِیرُ }[سُورَةُ المُلۡكِ: ١٤]	14
اذكر كلمة في آية بمعنى العظمة والجلال والغنى.	72	﴿وَأَنَّهُ تَعالى #جَدُّ# رَبِّنا مَا اتَّخَذَ صاحِبَةً وَلا وَلَدًا﴾ [الجن:3] قال ابن عاشور: (والجَدّ: بفتح الجيم العظمة والجلال، وهذا تمهيد وتوطئة لقوله: {ما اتخذ صاحبة ولا ولَداً}، لأن اتخاذ الصّاحبة للافتقار إليها لأنسها وعونها والالتذاذ بصحبتها، وكل ذلك من آثار الاحتياج، والله تعالى الغني الُمطلق، وتعالِي جَدّه بغناه المطلق، والولد يرغب فيه للاستعانة والأنس به، مع ما يقتضيه من انفصاله من أجزاء والديه وكل ذلك من الافتقار والانتقاص). 	3
اذكراية تدل على قيومية الله المستمرة، والتي لا تحل القوانين محلها. إذ أن القوانين ليست إلا أوصافا لأفعال الله بخلقه.	67	﴿أَوَلَم يَرَوا إِلَى الطَّيرِ فَوقَهُم صافّاتٍ وَيَقبِضنَ #ما يُمسِكُهُنَّ إِلَّا الرَّحمنُ# إِنَّهُ بِكُلِّ شَيءٍ بَصيرٌ﴾ [الملك:19] فمن يتأمل في الآية يجد أن تسخير الهواء للطير، وجعل أجسادهن وخلقتهن في حالة مستعدة للطيران، كل ذلك وصف لأفعال الله تعالى ﴿ما يُمسِكُهُنَّ إِلَّا الرَّحمنُ﴾.	19
اذكر آية فيها توجيه للكافرين ألّا تشغلهم عداوتهم للمؤمنين عن تطلُّب النجاة لأنفسهم.	67	{ قُلۡ أَرَءَیۡتُمۡ إِنۡ أَهۡلَكَنِیَ ٱللَّهُ وَمَن مَّعِیَ أَوۡ رَحِمَنَا فَمَن یُجِیرُ ٱلۡكَـٰفِرِینَ مِنۡ عَذَابٍ أَلِیمࣲ }[سُورَةُ المُلۡكِ: ٢٨]	28
قال الله تعالى:{وكَذَٰلِكَ جَعَلْنَاكُمْ أُمَّةً وَسَطًا} [البقرة : 143]، بمعنى الأفضل والأكثر خيرية. اذكر آية فيها الوسطية بالمعنى ذاته.	68	﴿قــالَ #أَوسَـــطُهُم# أَلَم أَقُل لَكُم لَولا تُسَبِّحونَ﴾ [القلم:28] قال ابن كثير: (﴿قـالَ أَوسَـطُهُم﴾ قال ابن عباس، ومجاهد، وسعيد بن جبير، وعكرمة، ومحمد بن كعب، والربيع بن أنس، والضحاك، وقتادة: أي: أعدلهم وخيرهم	28