نص السؤال	رقم السورة 	رقم الآية 	رقم آية1	رقم آية2
اذكر كلمة تشير إلى عدم إيمان امرأة لوط	51	﴿فَما وَجَدنا فيها غَيرَ بَيتٍ مِنَ #المُسلِمينَ#﴾ [الذاريات:36] قال ابن عاشور: (والآيَةُ تُشِيرُ إلى أنَّ امرَأةَ لُوطٍ كانَت تُظهِرُ الِانقِيادَ إلى زَوجِها وتُضمِرُ الكُفرَ ومُمالاةَ أهلِ القَريَةِ عَلى فَسادِهِم، قالَ تَعالى ﴿ضَرَبَ اللَّهُ مَثَلًا لِلَّذِينَ كَفَرُوا اِمْرَأةَ نُـوحٍ وامْرَأةَ لُوطٍ كانَتا تَحْـتَ عَبْدَيْنِ مِن عِبادِنا صالِحَيْنِ فَخانَتاهُمـا﴾ [التحريم:10] الآيَةَ، فَبَيتُ لُوطٍ كانَ كُلُّهُ مِنَ المُسلِمِينَ ولَم يَكُن كُلُّهُ مِنَ المُؤمِنِينَ فَلِذَلِكَ لَمْ يَنجُ مِنهم إلّا الَّذِينَ اتَّصَفُوا بِالإيمانِ والإسلامِ مَعًا). فامرأة لوط كانت مسلمة تظهر الانقياد للإسلام، لكنها لم تكن مؤمنة في الحقيقة. والله إنما نجى المؤمنين. فوصَفَت الآية بيت لوط بــ: ﴿بَيتٍ مِنَ المُسلِمينَ﴾ لوجود امرأة لوط بينهم، فإنها من المسلمين وليست من المؤمنين الناجين.	36	
قال الله تعالى في سورة النساء :{إِنَّ الْمُنَافِقِينَ يُخَادِعُونَ اللَّهَ وَهُوَ خَادِعُهُمْ} [النساء:142]. اذكر آية تبين كيف يخدعهم الله.	57	{يَوْمَ يَقُولُ الْمُنَافِقُونَ وَالْمُنَافِقَاتُ لِلَّذِينَ آمَنُوا انظُرُونَا نَقْتَبِسْ مِن نُّورِكُمْ قِيلَ ارْجِعُوا وَرَاءَكُمْ فَالْتَمِسُوا نُورًا فَضُرِبَ بَيْنَهُم بِسُورٍ لَّهُ بَابٌ بَاطِنُهُ فِيهِ الرَّحْمَةُ وَظَاهِرُهُ مِن قِبَلِهِ الْعَذَابُ} [سُورَةُ الحَدِيدِ: ١٣]	13	
آية بمعنى قول الله تعالى :{يَا أَيُّهَا الَّذِينَ آمَنُوا إِن تَتَّقُوا اللَّهَ يَجْعَل لَّكُمْ فُرْقَانًا} [الأنفال:29]	57	{يَا أَيُّهَا الَّذِينَ آمَنُوا اتَّقُوا اللَّهَ وَآمِنُوا بِرَسُولِهِ يُؤْتِكُمْ كِفْلَيْنِ مِن رَّحْمَتِهِ وَيَجْعَل لَّكُمْ نُورًا تَمْشُونَ بِهِ وَيَغْفِرْ لَكُمْ ۚ وَاللَّهُ غَفُورٌ رَّحِيمٌ} [سُورَةُ الحَدِيدِ: ٢٨]	28	
آية تبين عاقبة المخيفة في لحظة حاسمة يوم القيامة لمن يحيط نفسه بدواعي الانحراف من شهوات وشبهات. اذكر الكلمتين تحديدا في هذه الآية اللتين تذكران تسبب الشخص لنفسه بهذا الزيغ والانحراف	57	{يُنَادُونَهُمْ أَلَمْ نَكُن مَّعَكُمْ ۖ قَالُوا بَلَىٰ وَلَٰكِنَّكُمْ #فَتَنتُمْ أَنفُسَكُمْ# وَتَرَبَّصْتُمْ وَارْتَبْتُمْ وَغَرَّتْكُمُ الْأَمَانِيُّ حَتَّىٰ جَاءَ أَمْرُ اللَّهِ وَغَرَّكُم بِاللَّهِ الْغَرُورُ} [سُورَةُ الحَدِيدِ: ١٤ ]	14	
الناس يحاسبونك على النتائج والإنجازات، فلو أنك درست سنوات ثم لم تحصّل الشهادة الجامعية لظرف طرأ فإنك لا تعامَل معاملة من حصّلها. وعندما تكتب سيرتك الذاتية فإنك تكتب إنجازاتك، لا جهودك التي لم تثمر فيما يبدو. بينما الله سبحانه و تعالى من كمال عدله وحكمته أنه لم يُحاسب على العمل والمحاولة حتى وإن لم يؤدّ إلى نتائج الدنيوية المرجوّة. اذكر كلمة واحدة من آية تدل على هذا المعنى.	53	{وَأَن لَّيْسَ لِلْإِنسَانِ إِلَّا مَا #سَعَىٰ# (39) وَأَنَّ #سَعْيَهُ# سَوْفَ يُرَىٰ (40)}[سُورَةُ النَّجۡمِ: ٤٠ ]	39	40
من الأعمال الصالحة ما يكون أكثر أجرا في حالة معينة و أقل أجرا في حالة أخرى فالأصل أن يتحرى المسلم القيام بهذه الأعمال في الأوقات التي تشتد فيها الحاجة إليها.  اذكر آية من الجزء السابع و العشرين واخرى من الجزء الثلاثين فيهما هذا المعنى . 	57/90	{وَمَا لَكُمۡ أَلَّا تُنفِقُوا۟ فِی سَبِیلِ ٱللَّهِ وَلِلَّهِ مِیرَ ٰ⁠ثُ ٱلسَّمَـٰوَ ٰ⁠تِ وَٱلۡأَرۡضِۚ #لَا یَسۡتَوِی مِنكُم مَّنۡ أَنفَقَ مِن قَبۡلِ ٱلۡفَتۡحِ وَقَـٰتَلَۚ أُو۟لَـٰۤىِٕكَ أَعۡظَمُ دَرَجَةࣰ مِّنَ ٱلَّذِینَ أَنفَقُوا۟ مِنۢ بَعۡدُ وَقَـٰتَلُوا۟ۚ# وَكُلࣰّا وَعَدَ ٱللَّهُ ٱلۡحُسۡنَىٰۚ وَٱللَّهُ بِمَا تَعۡمَلُونَ خَبِیرࣱ }[سُورَةُ الحَدِيدِ: ١٠ ] ﴿أَوْ إِطْعَامٌ فِي يَوْمٍ ذِي مَسْغَبَةٍ﴾ [البلد:14]	10	14
آية ورد فيها تعجب من حال أقوام، لمخالفتهم أمرا بدهيا ، إلا أن هذا التعجب قد يبدو للبعض منقوصا غير واضح ، و لكن يتضح و يستقيم فهمه إذا قُدّر في الآية أن دعوة النبي ﷺ للناس كانت مدعمة بالبراهين الكافية بما يقيم الحجة على الناس.	57	﴿#وَمَا لَكُمْ لَا تُؤْمِنُونَ بِاللَّهِ ۙ وَالرَّسُولُ يَدْعُوكُمْ لِتُؤْمِنُوا بِرَبِّكُمْ# وَقَدْ أَخَذَ مِيثَاقَكُمْ إِن كُنتُم مُّؤْمِنِينَ﴾ [الحديد:8] قال ابن عاشور: (والمعنى: ماذا يمنَعكم من الإيمان وقد بين لكم الرسولُ من آيات القرآن ما فيه بلاغ وحجة على أن الإِيمان بالله حق؟ فلا عذر لكم في عدم الإِيمان بالله. فقد جاءتكم بينات حقّيّته (أي أنه حق) فتعين أن إصراركم على عدم الإِيمان مكابرة وعناد). فليس معنى الآية الإنكار عليهم أنهم لا يؤمنون بدعوة رجلٍ ما مجردة، بل أنهم ينكرون دعوة مَن قامت الحجج على أنه رسول، ويدعوهم إلى الإيمان الذي تدل عليه الفطرة والعقل. 	8	